{
  "registry_id": "nova.pine-capabilities",
  "registry_version": "v1",
  "effective_date": "2026-07-18",
  "capabilities": [
    {
      "capability_id": "BASIC_INDICATOR_BOOLEAN_SIGNAL",
      "family": "signals",
      "pine_patterns": ["indicator declaration with boolean conditions"],
      "pine_apis": ["indicator"],
      "minimum_pine_version": 5,
      "maximum_tested_pine_version": 6,
      "capability_level": "L0_DIRECTLY_SUPPORTED",
      "temporal_class": "T0_CONFIRMED_BAR_CLOSE_DETERMINISTIC",
      "required_nova_backend_capability": "CURRENT_TARGET_STATE_ROUTING",
      "conversion_policy": "DIRECT",
      "allowed_normalization": "Emit canonical directional or flat booleans.",
      "mandatory_disclosure": [],
      "blocker_code": null,
      "admin_review_points": [],
      "user_facing_message": "Basic boolean indicator logic is directly representable.",
      "fixtures": ["F05", "F59"],
      "effective_version": "v1",
      "deprecated_version": null,
      "priority": 10
    },
    {
      "capability_id": "MARKET_DIRECTIONAL_ENTRY",
      "family": "entries",
      "pine_patterns": ["strategy.entry without stop or limit"],
      "pine_apis": ["strategy.entry"],
      "minimum_pine_version": 5,
      "maximum_tested_pine_version": 6,
      "capability_level": "L0_DIRECTLY_SUPPORTED",
      "temporal_class": "T0_CONFIRMED_BAR_CLOSE_DETERMINISTIC",
      "required_nova_backend_capability": "CURRENT_TARGET_STATE_ROUTING",
      "conversion_policy": "NORMALIZE_TARGET_STATE",
      "allowed_normalization": "Long maps to BULLISH and short maps to BEARISH.",
      "mandatory_disclosure": [],
      "blocker_code": null,
      "admin_review_points": [],
      "user_facing_message": "Market directional intent can use NOVA target-state routing.",
      "fixtures": ["F01", "F02"],
      "effective_version": "v1",
      "deprecated_version": null,
      "priority": 20
    },
    {
      "capability_id": "EXPLICIT_FULL_FLATTEN",
      "family": "exits",
      "pine_patterns": ["strategy.close", "strategy.close_all"],
      "pine_apis": ["strategy.close", "strategy.close_all"],
      "minimum_pine_version": 5,
      "maximum_tested_pine_version": 6,
      "capability_level": "L0_DIRECTLY_SUPPORTED",
      "temporal_class": "T0_CONFIRMED_BAR_CLOSE_DETERMINISTIC",
      "required_nova_backend_capability": "CURRENT_FULL_EXIT_ROUTING",
      "conversion_policy": "NORMALIZE_TARGET_STATE",
      "allowed_normalization": "Collapse the current single position to FLAT.",
      "mandatory_disclosure": [],
      "blocker_code": null,
      "admin_review_points": [],
      "user_facing_message": "A full flatten is representable as EXIT.",
      "fixtures": ["F03", "F08"],
      "effective_version": "v1",
      "deprecated_version": null,
      "priority": 20
    },
    {
      "capability_id": "OPPOSITE_DIRECTION_REVERSAL_NORMALIZATION",
      "family": "transitions",
      "pine_patterns": ["opposite strategy.entry directions"],
      "pine_apis": ["strategy.entry"],
      "minimum_pine_version": 5,
      "maximum_tested_pine_version": 6,
      "capability_level": "L1_NORMALIZED_WITHOUT_MATERIAL_CHANGE",
      "temporal_class": "T0_CONFIRMED_BAR_CLOSE_DETERMINISTIC",
      "required_nova_backend_capability": "CURRENT_EXIT_FIRST_REVERSAL",
      "conversion_policy": "NORMALIZE_TARGET_STATE",
      "allowed_normalization": "Emit the opposite desired state; NOVA retains exit-first routing.",
      "mandatory_disclosure": ["DISC_EXIT_FIRST_REVERSAL"],
      "blocker_code": null,
      "admin_review_points": ["Confirm source does not require atomic broker reversal."],
      "user_facing_message": "Opposite intent uses NOVA's existing exit-first reversal.",
      "fixtures": ["F06"],
      "effective_version": "v1",
      "deprecated_version": null,
      "priority": 30
    },
    {
      "capability_id": "SAME_SIDE_STATE_NO_OP",
      "family": "transitions",
      "pine_patterns": ["repeated same-direction strategy.entry with pyramiding zero"],
      "pine_apis": ["strategy.entry"],
      "minimum_pine_version": 5,
      "maximum_tested_pine_version": 6,
      "capability_level": "L1_NORMALIZED_WITHOUT_MATERIAL_CHANGE",
      "temporal_class": "T0_CONFIRMED_BAR_CLOSE_DETERMINISTIC",
      "required_nova_backend_capability": "CURRENT_STATE_NO_OP",
      "conversion_policy": "NORMALIZE_TARGET_STATE",
      "allowed_normalization": "Repeated same-side target state remains a no-op.",
      "mandatory_disclosure": [],
      "blocker_code": null,
      "admin_review_points": [],
      "user_facing_message": "Repeated same-side signals are absorbed as no-ops.",
      "fixtures": ["F07"],
      "effective_version": "v1",
      "deprecated_version": null,
      "priority": 25
    },
    {
      "capability_id": "EXIT_WHILE_FLAT_NO_OP",
      "family": "transitions",
      "pine_patterns": ["flat-state guard followed by full close"],
      "pine_apis": ["strategy.position_size", "strategy.close", "strategy.close_all"],
      "minimum_pine_version": 5,
      "maximum_tested_pine_version": 6,
      "capability_level": "L1_NORMALIZED_WITHOUT_MATERIAL_CHANGE",
      "temporal_class": "T0_CONFIRMED_BAR_CLOSE_DETERMINISTIC",
      "required_nova_backend_capability": "CURRENT_STATE_NO_OP",
      "conversion_policy": "NORMALIZE_TARGET_STATE",
      "allowed_normalization": "A FLAT request while flat is a no-op.",
      "mandatory_disclosure": [],
      "blocker_code": null,
      "admin_review_points": [],
      "user_facing_message": "Exit while flat is safely ignored.",
      "fixtures": ["F08"],
      "effective_version": "v1",
      "deprecated_version": null,
      "priority": 25
    },
    {
      "capability_id": "CONFIRMED_BAR_CLOSE_TIMING",
      "family": "temporal",
      "pine_patterns": ["barstate.isconfirmed", "alert.freq_once_per_bar_close"],
      "pine_apis": ["barstate.isconfirmed", "alert.freq_once_per_bar_close"],
      "minimum_pine_version": 5,
      "maximum_tested_pine_version": 6,
      "capability_level": "L0_DIRECTLY_SUPPORTED",
      "temporal_class": "T0_CONFIRMED_BAR_CLOSE_DETERMINISTIC",
      "required_nova_backend_capability": "CURRENT_BAR_CLOSE_TRANSPORT",
      "conversion_policy": "DIRECT",
      "allowed_normalization": "Preserve confirmed bar-close emission.",
      "mandatory_disclosure": [],
      "blocker_code": null,
      "admin_review_points": [],
      "user_facing_message": "The signal is explicitly confirmed at bar close.",
      "fixtures": ["F05"],
      "effective_version": "v1",
      "deprecated_version": null,
      "priority": 40
    },
    {
      "capability_id": "CONFIRMED_HTF_OFFSET_PATTERN",
      "family": "multi_timeframe",
      "pine_patterns": ["request.security expression offset with lookahead_on"],
      "pine_apis": ["request.security", "barmerge.lookahead_on"],
      "minimum_pine_version": 5,
      "maximum_tested_pine_version": 6,
      "capability_level": "L1_NORMALIZED_WITHOUT_MATERIAL_CHANGE",
      "temporal_class": "T3_HTF_CONFIRMED_OFFSET_SERIES",
      "required_nova_backend_capability": "CURRENT_ANALYTICAL_SIGNAL_ROUTING",
      "conversion_policy": "DIRECT",
      "allowed_normalization": "Preserve the confirmed prior higher-timeframe value.",
      "mandatory_disclosure": ["DISC_HTF_CONFIRMED_SOURCE"],
      "blocker_code": null,
      "admin_review_points": ["Verify the offset applies to the requested expression."],
      "user_facing_message": "Confirmed higher-timeframe data is preserved with provenance.",
      "fixtures": ["F42"],
      "effective_version": "v1",
      "deprecated_version": null,
      "priority": 80
    },
    {
      "capability_id": "UNSAFE_FUTURE_LOOKAHEAD",
      "family": "multi_timeframe",
      "pine_patterns": ["lookahead_on without a confirmed expression offset"],
      "pine_apis": ["request.security", "barmerge.lookahead_on"],
      "minimum_pine_version": 5,
      "maximum_tested_pine_version": 6,
      "capability_level": "L4_BLOCKED_UNSAFE_OR_UNREPRESENTABLE",
      "temporal_class": "T4_FUTURE_LEAKAGE_LOOKAHEAD",
      "required_nova_backend_capability": "NONE",
      "conversion_policy": "BLOCK_UNSAFE",
      "allowed_normalization": "",
      "mandatory_disclosure": [],
      "blocker_code": "BLK_FUTURE_LEAK",
      "admin_review_points": ["Confirm no future data is exposed."],
      "user_facing_message": "Future-leaking lookahead is blocked.",
      "fixtures": ["F44"],
      "effective_version": "v1",
      "deprecated_version": null,
      "priority": 100
    },
    {
      "capability_id": "INTRABAR_VARIP_STATE",
      "family": "temporal",
      "pine_patterns": ["varip declaration"],
      "pine_apis": ["varip"],
      "minimum_pine_version": 5,
      "maximum_tested_pine_version": 6,
      "capability_level": "L4_BLOCKED_UNSAFE_OR_UNREPRESENTABLE",
      "temporal_class": "T8_INTRABAR_NONREPRODUCIBLE_STATE",
      "required_nova_backend_capability": "NONE",
      "conversion_policy": "BLOCK_UNSAFE",
      "allowed_normalization": "",
      "mandatory_disclosure": [],
      "blocker_code": "BLK_NONREPRODUCIBLE",
      "admin_review_points": [],
      "user_facing_message": "Intrabar-persistent varip behavior is not reproducible safely.",
      "fixtures": ["F40"],
      "effective_version": "v1",
      "deprecated_version": null,
      "priority": 100
    },
    {
      "capability_id": "CALC_ON_EVERY_TICK",
      "family": "temporal",
      "pine_patterns": ["calc_on_every_tick=true"],
      "pine_apis": ["strategy"],
      "minimum_pine_version": 5,
      "maximum_tested_pine_version": 6,
      "capability_level": "L4_BLOCKED_UNSAFE_OR_UNREPRESENTABLE",
      "temporal_class": "T8_INTRABAR_NONREPRODUCIBLE_STATE",
      "required_nova_backend_capability": "NONE",
      "conversion_policy": "BLOCK_UNSAFE",
      "allowed_normalization": "",
      "mandatory_disclosure": [],
      "blocker_code": "BLK_INTRABAR_TIMING",
      "admin_review_points": [],